{
  "@version": "EP-CLEAN-ROOM-SUBMISSION-v1",
  "implementation": {
    "implementation_id": "emilia-js-reference",
    "organization": "EMILIA Protocol",
    "language": "JavaScript",
    "version": "workspace",
    "source_repository": "https://github.com/emiliaprotocol/emilia-protocol",
    "source_commit": "workspace",
    "license_spdx": "Apache-2.0",
    "build_instructions": "Use the checked-in JavaScript conformance runner.",
    "dependencies": [
      "EMILIA reference source"
    ]
  },
  "runner": {
    "protocol": "EP-CONFORMANCE-FILE-RUNNER-v1",
    "artifact_argument_index": 0,
    "artifact_sha256": "08c372d7d90ffe231a0967663b4ccd1e18dc86b8d7efb4d001fecf7c7e4397e9",
    "fixed_arguments": [
      "conformance/runners/run-js.mjs"
    ]
  },
  "independence": {
    "claimed": false,
    "authors": [
      "EMILIA maintainers"
    ],
    "specification_inputs": [
      "EMILIA specifications",
      "EMILIA reference source"
    ],
    "specification_bundle_sha256": "0deba7fb430e5b86046a503e4ea57cb8d1d080f457ceae949192c9894c820ca0",
    "reference_source_access": "reference_port",
    "emilia_affiliation": "maintainer",
    "statement": "This manifest exercises the intake harness only and makes no clean-room or independence claim."
  }
}
